{
  "manifest_version": "1",
  "generated_at": "2026-07-09T20:44:02+02:00",
  "commit": "98d946a102569ce542cb15a576f6d90286a739fe",
  "entries": [
    {
      "id": "EV-001",
      "requirement": "REQ-AGENT-003",
      "claim": "PendingAction confirmations are server-minted, action-hash-bound, single-use, reject mismatched/expired/replayed tokens, and do not consume the token on action-hash mismatch.",
      "method": "test",
      "command": "cargo +1.95.0 test -p isyncyou-agent confirm -- --nocapture",
      "result": "pass",
      "test": "confirmation_token_is_single_use_and_action_bound",
      "evidence": "The confirm test filter passed 8 tests covering action-bound one-time tokens, replay rejection, token-from-another-pending rejection, expiry, action-hash mismatch without token consumption, unknown ids, and action-hash binding field mutation.",
      "artifact": "docs/evidence/artifacts/issue-621/host-gates.txt"
    },
    {
      "id": "EV-002",
      "requirement": "REQ-AGENT-003",
      "claim": "Confirmed destructive actions are consumed exactly once, audited with start and ok/error rows around the executor call, and replay does not execute again.",
      "method": "test",
      "command": "cargo +1.95.0 test -p isyncyou-app-host --features agent-subscription-experimental agent_confirm -- --nocapture",
      "result": "pass",
      "test": "agent_confirm_audits_once_and_calls_executor_once",
      "evidence": "The app-host confirmation tests passed, proving start audit before executor, ok/error audit after executor, replay rejection without a second executor call, executor error redaction, invalid pending with no audit/execution, and audit-start failure with no executor call.",
      "artifact": "docs/evidence/artifacts/issue-621/host-gates.txt"
    },
    {
      "id": "EV-003",
      "requirement": "REQ-AGENT-004",
      "claim": "The provider-visible model context and turn history contain no capability, session, confirmation, OAuth, provider, or bridge-token sentinels.",
      "method": "test",
      "command": "cargo +1.95.0 test -p isyncyou-agent agent_context_contains_no_capability_token -- --nocapture",
      "result": "pass",
      "test": "agent_context_contains_no_capability_token",
      "evidence": "A history-capture provider recorded the model-visible history; the test asserts absence of cap/session/confirmation/OAuth/provider/bridge token sentinel strings in provider history and final turn history.",
      "artifact": "docs/evidence/artifacts/issue-621/host-gates.txt"
    },
    {
      "id": "EV-004",
      "requirement": "REQ-AGENT-004",
      "claim": "Confirmation-required metadata is a UI-only event and is not pushed back into provider history; stream token events and audit/error summaries do not leak confirmation tokens.",
      "method": "test",
      "command": "cargo +1.95.0 test -p isyncyou-agent confirmation_required_event_not_in_provider_history -- --nocapture && cargo +1.95.0 test -p isyncyou-app-host --features agent-subscription-experimental agent_stream_token_events_contain_no_confirmation_token -- --nocapture && cargo +1.95.0 test -p isyncyou-app-host --features agent-subscription-experimental agent_error_and_audit_redact_confirmation_token -- --nocapture",
      "result": "pass",
      "test": "confirmation_required_event_not_in_provider_history",
      "evidence": "The no-leak tests passed: provider history excludes confirmation_required/pending_id/action_hash/expiry metadata; stream token events exclude the later confirmation token; executor errors and audit entries redact raw confirmation-token-bearing text.",
      "artifact": "docs/evidence/artifacts/issue-621/host-gates.txt"
    },
    {
      "id": "EV-005",
      "requirement": "REQ-AGENT-007",
      "claim": "AgentStreamHub emits stable typed events with done reasons, remains bounded, times out on slow consumers, and supports terminal cancellation.",
      "method": "test",
      "command": "cargo +1.95.0 test -p isyncyou-agent stream -- --nocapture",
      "result": "pass",
      "test": "agent_stream_hub_emits_typed_events_and_cancels",
      "evidence": "The stream test filter passed 9 tests proving typed token/tool/result/confirmation/error/done JSON, single-line stable serialization, bounded sync_channel use, timeout behavior for slow consumers, and cancelled terminal done events.",
      "artifact": "docs/evidence/artifacts/issue-621/host-gates.txt"
    },
    {
      "id": "EV-006",
      "requirement": "REQ-AGENT-007",
      "claim": "DaemonAgent runs a full FakeProvider turn over the stream hub, registers pending destructive actions without executing them, confirms exactly once, cancels with done.reason=cancelled, and sweeps unopened streams.",
      "method": "test",
      "command": "cargo +1.95.0 test -p isyncyou-app-host --features agent-subscription-experimental daemon_agent -- --nocapture",
      "result": "pass",
      "test": "daemon_agent_fake_turn_streams_tokens_to_subscriber",
      "evidence": "The daemon_agent filter passed 7 tests covering token streaming, destructive pending registration without execution, pending_confirmation stream closure, confirm result/replay rejection, cancelled done, and unopened stream TTL sweep.",
      "artifact": "docs/evidence/artifacts/issue-621/host-gates.txt"
    },
    {
      "id": "EV-007",
      "requirement": "REQ-AGENT-007",
      "claim": "The WebUI agent API exposes /turn and /chat, requires action_hash for confirm, cap-gates agent POSTs, session-gates mobile POST/status/SSE paths, and applies the same gate to bridge streams.",
      "method": "test",
      "command": "cargo +1.95.0 test -p isyncyou-webui agent -- --nocapture",
      "result": "pass",
      "test": "agent_chat_alias_matches_turn_route",
      "evidence": "The webui agent filter passed 12 tests covering /chat alias behavior, confirm action_hash validation, cap-token validation, mobile session-before-cap behavior, status session/no-cap behavior, real HTTP agent SSE session gating, and Android bridge stream gating.",
      "artifact": "docs/evidence/artifacts/issue-621/agent-api-trace.json"
    },
    {
      "id": "EV-008",
      "requirement": "REQ-AGENT-007",
      "claim": "The #621 branch passed targeted host gates for tests, clippy, formatting, traceability, evidence validation, and whitespace checks.",
      "method": "command",
      "command": "cargo +1.95.0 test -p isyncyou-agent turn -- --nocapture && cargo +1.95.0 test -p isyncyou-app-host --features agent-subscription-experimental agent -- --nocapture && cargo +1.95.0 test -p isyncyou-webui agent -- --nocapture && cargo +1.95.0 clippy -p isyncyou-agent --all-targets --features http,agent-subscription-experimental -- -D warnings && cargo +1.95.0 clippy -p isyncyou-app-host --all-targets --features agent-subscription-experimental -- -D warnings && cargo +1.95.0 clippy -p isyncyou-webui --all-targets -- -D warnings && cargo +1.95.0 fmt --all --check && python3 tools/check_traceability.py && python3 tools/check_evidence.py --manifest docs/evidence/issue-621-manifest.json && git diff --check",
      "result": "pass",
      "evidence": "Task-level gates passed for Tasks 1 through 6. Task 7 validates traceability and this evidence manifest; final Task 8 reruns the required aggregate gates before any push/PR.",
      "artifact": "docs/evidence/artifacts/issue-621/host-gates.txt"
    }
  ]
}
