{
  "manifest_version": "1",
  "generated_at": "2026-06-05T08:00:00Z",
  "commit": "0e3cbd7116d08fb13606303c4899127422eab2ad",
  "entries": [
    {
      "id": "EV-001",
      "requirement": "REQ-RST-001",
      "claim": "Cloud restore is refused when the opt-in flag is off (default).",
      "method": "test",
      "command": "cargo test -p isyncyou-engine restore_cloud_refuses_when_disabled_by_default",
      "result": "pass",
      "evidence": "test tests::restore_cloud_refuses_when_disabled_by_default ... ok",
      "test": "restore_cloud_refuses_when_disabled_by_default"
    },
    {
      "id": "EV-002",
      "requirement": "REQ-RST-002",
      "claim": "Local-file restore recovers the exact archived bytes with no token and no network.",
      "method": "test",
      "command": "cargo test -p isyncyou-cli restore_to_local_recovers_an_archived_item",
      "result": "pass",
      "evidence": "test tests::restore_to_local_recovers_an_archived_item ... ok",
      "test": "restore_to_local_recovers_an_archived_item"
    },
    {
      "id": "EV-003",
      "requirement": "REQ-RST-003",
      "claim": "A crash after the Graph POST but before the local record does not duplicate the item; recovery reconciles to exactly one.",
      "method": "example",
      "command": "cargo run -p isyncyou-engine --example crash_matrix",
      "result": "pass",
      "evidence": "C4 crash after POST, before record       Reconciled       1        1  OK  ||  ADR-001 invariant holds: exactly one cloud item in every case, no duplicates.",
      "artifact": "crates/engine/examples/crash_matrix.rs"
    },
    {
      "id": "EV-004",
      "requirement": "REQ-RST-004",
      "claim": "A concurrent identical restore is rejected by the ledger's unique idempotency key, so only one item is created.",
      "method": "test",
      "command": "cargo test -p isyncyou-engine c6_concurrent_identical_key_is_rejected_by_ledger",
      "result": "pass",
      "evidence": "test restore_recovery::tests::c6_concurrent_identical_key_is_rejected_by_ledger ... ok",
      "test": "c6_concurrent_identical_key_is_rejected_by_ledger"
    },
    {
      "id": "EV-005",
      "requirement": "REQ-SYNC-002",
      "claim": "The mass-delete guard halts an over-threshold deletion in both directions.",
      "method": "test",
      "command": "cargo test -p isyncyou-acceptance a2_delete_guard_both_directions",
      "result": "pass",
      "evidence": "test a2_delete_guard_both_directions ... ok",
      "test": "a2_delete_guard_both_directions"
    },
    {
      "id": "EV-006",
      "requirement": "REQ-SYNC-005",
      "claim": "An interrupted chunked upload resumes from persisted session state across a process kill.",
      "method": "test",
      "command": "cargo test -p isyncyou-acceptance a5_upload_resume_survives_kill",
      "result": "pass",
      "evidence": "test a5_upload_resume_survives_kill ... ok",
      "test": "a5_upload_resume_survives_kill"
    },
    {
      "id": "EV-007",
      "requirement": "REQ-RST-004",
      "claim": "The content-derived idempotency key is deterministic and per-field sensitive.",
      "method": "test",
      "command": "cargo test -p isyncyou-engine key_is_deterministic_and_hex",
      "result": "pass",
      "evidence": "test restore_key::tests::key_is_deterministic_and_hex ... ok",
      "test": "key_is_deterministic_and_hex"
    },
    {
      "id": "EV-008",
      "requirement": "REQ-RST-003",
      "claim": "Mail restore is wired through the ledger: a crash after the POST landed reconciles without creating a duplicate (proven against a non-idempotent fake mailbox).",
      "method": "test",
      "command": "cargo test -p isyncyou-engine crash_after_post_landed_does_not_duplicate",
      "result": "pass",
      "evidence": "test mail_restore::tests::crash_after_post_landed_does_not_duplicate ... ok",
      "notes": "Live confirmation that Graph returns a posted Message-ID via an internetMessageId $filter is still pending a write token; cloud_restore_enabled stays false until then.",
      "test": "crash_after_post_landed_does_not_duplicate"
    },
    {
      "id": "EV-009",
      "requirement": "REQ-RST-005",
      "claim": "The daemon recovers an in-flight mail restore on boot, reconciling without a new create.",
      "method": "test",
      "command": "cargo test -p isyncyou-engine boot_recovery_reconciles_a_pending_op_without_creating",
      "result": "pass",
      "evidence": "test mail_restore::tests::boot_recovery_reconciles_a_pending_op_without_creating ... ok",
      "test": "boot_recovery_reconciles_a_pending_op_without_creating"
    },
    {
      "id": "EV-010",
      "requirement": "REQ-RST-003",
      "claim": "Live: Microsoft Graph preserves a posted Message-ID as internetMessageId and an internetMessageId $filter finds it — the marker probe the crash recovery relies on.",
      "method": "probe",
      "command": "python3 tools/live_restore_probe.py",
      "result": "pass",
      "evidence": "POST /me/messages -> 201; internetMessageId == posted Message-ID; GET $filter -> 1 match; cleanup DELETE -> 204; VERDICT YES",
      "artifact": "tools/live_restore_probe.py"
    }
  ]
}
