{
  "manifest_version": "1",
  "generated_at": "2026-07-09T18:56:38+02:00",
  "commit": "3699bc40a7404ca9e5310f32e451ea9dcc048893",
  "entries": [
    {
      "id": "EV-001",
      "requirement": "REQ-AGENT-010",
      "claim": "The agent CredentialStore round-trips all typed secret classes and rejects empty secrets, wrong-class copies, metadata mutation, delimiter collisions, and plaintext-at-rest regressions.",
      "method": "test",
      "command": "cargo +1.95.0 test -p isyncyou-agent secrets -- --nocapture",
      "result": "pass",
      "test": "secrets_each_class_round_trips",
      "evidence": "The secrets test run passed the typed class round-trip, empty-secret rejection, wrong-class copy, envelope class/id/version mutation, delimiter-safe AAD, ciphertext sentinel, owner-only file, wrong-key redaction, and delete/local-key persistence tests.",
      "artifact": "docs/evidence/artifacts/issue-620/host-gates.txt"
    },
    {
      "id": "EV-002",
      "requirement": "REQ-AGENT-010",
      "claim": "The credential resolver and provider seams centralize key-source precedence and provider credential id construction without leaking credential material.",
      "method": "test",
      "command": "cargo +1.95.0 test -p isyncyou-agent credential -- --nocapture && cargo +1.95.0 test -p isyncyou-agent provider_ -- --nocapture",
      "result": "pass",
      "test": "credential_resolver_prefers_process_key_over_env_or_local",
      "evidence": "Resolver/provider tests passed for provided/process/env/local key precedence, owner-only local key generation, redacted resolver errors, stable provider secret ids, rejected unsafe ids, and store-backed API-key lookup.",
      "artifact": "docs/evidence/artifacts/issue-620/host-gates.txt"
    },
    {
      "id": "EV-003",
      "requirement": "REQ-AGENT-010",
      "claim": "App-host subscription and Codex credential consumers use the central agent credential store helper instead of repeated LocalKey construction.",
      "method": "test",
      "command": "cargo +1.95.0 test -p isyncyou-app-host --features agent-subscription-experimental credential -- --nocapture",
      "result": "pass",
      "test": "subscription_credential_round_trips_through_agent_credential_store",
      "evidence": "App-host credential tests passed for subscription and Codex round-trips, credential-store precedence over desktop CLI fallback, and redacted stored credential errors.",
      "artifact": "docs/evidence/artifacts/issue-620/host-gates.txt"
    },
    {
      "id": "EV-004",
      "requirement": "REQ-AGENT-010",
      "claim": "The default mobile Rust path requires an installed agent credential key before opening local data, and the self-test feature validates the process-installed key path.",
      "method": "test",
      "command": "cargo +1.95.0 test -p isyncyou-mobile --features agent-credential-store-self-test -- --nocapture",
      "result": "pass",
      "test": "mobile_start_inner_fails_closed_without_agent_credential_key",
      "evidence": "Mobile tests passed for key length validation, panic/failure handling, successful process key install, fail-closed start_inner behavior without the key, and feature-gated self-test JSON.",
      "artifact": "docs/evidence/artifacts/issue-620/host-gates.txt"
    },
    {
      "id": "EV-005",
      "requirement": "REQ-AGENT-010",
      "claim": "Pixel 8 Pro instrumentation proved a separate Android Keystore-wrapped agent credential key installs through JNI and seals a provider credential store without plaintext sentinel residue.",
      "method": "probe",
      "command": "(cd android && ISY_CARGO_FEATURES=agent-credential-store-self-test ./gradlew :app:connectedDebugAndroidTest -Pandroid.testInstrumentationRunnerArguments.class=com.silentspike.isyncyou.AgentCredentialKeyStoreInstrumentedTest)",
      "result": "pass",
      "evidence": "Instrumentation reported tests=1 failures=0 errors=0 skipped=0. Extracted JSON shows alias=isyncyou-agent-credential-wrap-v1, key_file=agent_credential.key, inside_secure_hardware=true, security_level=trusted_environment, key_source=android_installed, round_trip=true, and no plaintext sentinel in the credential store or wrapped key file.",
      "artifact": "docs/evidence/artifacts/issue-620/android-keystore.json"
    },
    {
      "id": "EV-006",
      "requirement": "REQ-AGENT-010",
      "claim": "The #620 branch is green under the targeted host gates for formatting, clippy, Android JVM tests, traceability, evidence validation, and whitespace checks.",
      "method": "command",
      "command": "cargo +1.95.0 fmt --all --check && cargo +1.95.0 clippy -p isyncyou-agent --all-targets --features http,agent-subscription-experimental -- -D warnings && cargo +1.95.0 clippy -p isyncyou-app-host --all-targets --features agent-subscription-experimental -- -D warnings && cargo +1.95.0 clippy -p isyncyou-mobile --all-targets --features agent-credential-store-self-test -- -D warnings && (cd android && ./gradlew :app:testDebugUnitTest) && python3 tools/check_traceability.py && python3 tools/check_evidence.py --manifest docs/evidence/issue-620-manifest.json && git diff --check origin/dev...HEAD",
      "result": "pass",
      "evidence": "Targeted host gates passed during Task 1 through Task 7; final plan-audit gates are rerun before push/PR.",
      "artifact": "docs/evidence/artifacts/issue-620/host-gates.txt"
    }
  ]
}
